 DÉCADA 1960-1969,,,,,,,,,,,,,,,,,,,,,,,,,
,TITULO,,,,,,,,MENCIÓN DE RESPONSABILIDADES,,,,,,,,,SONIDO,,MÚSICA,,,,,
Código de referencia,Propio,Paralelo,Atribuido,Titulo de serie,Número programa,País,Fecha,Duración,Investigación,Realización,Dirección,Guión,Adaptación,Idea original,Fotografía,Fotografía fija,Edición,Grabación,Edición,Original,Musicalización,Voces,Actores,Animación,Otros colaboradores
MXIM-AV-1-8-1,La pyramide humaine,La pirámide humana,,Ciné-Rencontre,Volumen 3,Francia,1961,1:30:00,,Jean Rouch,,Jean Rouch,,,"Louis Miaille, Roger Morilliere, Serge ricci, Mario Da Costa, Jean Rouch",,"Marie Josèphe Yoyotte, Francine Grubert, Geneviève Bastid, Liliane Korb","Michel Fano, Guy Rophé ",,,,,,,
MXIM-AV-1-8-2,Tire Die,,,,,Argentina,1960,0:33:00,,Fernando Birri,,Fernando Birri con la colaboración de 59 alumnos de la Escuela de Cine Documental,,,,,Antonio Ripoll,,,,,Guillermo Cervantes Luro,,,"Voces: Francisco Petrone, María Rosa Gallo, Guillermo Cervantes Luro"
MXIM-AV-1-8-3,A Valparaiso,,,,,Chile/Francia,1962,0:26:38,,Joris Ivens,,Chris Marker,,,"Georges Strouvé , Asistente de cámara: Patricio Guzmán",,Jean Ravel,,,Gustavo Becerra,,Roger Pigaut,,,
MXIM-AV-1-8-4,Skizbe,"O inicio, El principio",,,,Armenia,1967,0:09:00,,Artavazd Pelechian,,,,,E. Karavaiev,,,,O. Polissonov,,Sviridov,,,,
MXIM-AV-1-8-5,Menq,"Nós, Nosotros",,,,Armenia,1969,0:23:00,,Artavazd Pelechian,,,,,,,L. Volkova,,F. Amirkhanian,,,,,,
MXIM-AV-1-8-6,Chiefs,,,,,Estados Unidos,1969,0:18:00,,"Richard Leacock, Noel E. Parmentel Jr.",,,,,,,,,,,,,,,
MXIM-AV-1-8-7,Chronique d'un été,Crónica de un verano,,,,Francia,1960,1:25:10,"Jean Rouch, Edgar Morin","Jean Rouch, Edgar Morin",Don A. Pennebaker,,, ,"Roger Moriller, Raoul Coutard, Jean- Jacques Tarbes y Michael Brault", ,"Jean Ravel, Néna Baratier, Francois Colin", ,"Michel Fano, Gy Rophé",,Pierre Barbaud,,,,"Asistentes: Claude Beausoleil, Louis Boucher"
MXIM-AV-1-8-8,Comizi d´amore,Encuesta  de amor,,,,Italia,1965,1:30:00,,Pier Paolo Pasolini,Pier Paolo Pasolini,,,,"Mario Bernardo, Tonino delli Colli",,Nino Baragli,"Oscar de Arcangelis, Carlo Ramundo","RCA Haliana, Fonolux",,,Lello Bersani,,,Dirección artística: Pier Paolo Pasolini
MXIM-AV-1-8-9,Don´t look back,,,,,Estados Unidos,1967,1:36:00,,D.A. Pennebaker,,D.A. Pennebaker,,,"Howard Alk, Jones Alk, Ed Emshwiller, D.A. Pennebaker",,D.A. Pennebaker,Robert Van Dyke,,Bob Dylan,,,,,
MXIM-AV-1-8-10,Menq ,"We, Nosotros",,,,URSS,1969,0:23:00,Artavazd Pelechian,Artavazd Pelechian,,,,,,,L. Volkova,,F. Amirkhanian,,,,,,
MXIM-AV-1-8-11,Fotografia della Famiglia Italiana,Fotografía de la familia italiana,,,,Italia,1969,0:21:58,,Virgilio Tossi,,,,,Carlo Vertimiglia,,,,,,Franco Potenza,,,,
MXIM-AV-1-8-12,Hanoi  Martes 13,,,,,"La Habana, Cuba",1968,0:33:29,,Santiago Álvarez,,,,,Iván Nápoles, ,"Idalberto Galvéz, Norma Torrado", ,,, Leo Brouwer, , ,Pepin Rodríguez,
MXIM-AV-1-8-13,Hasta la victoria siempre/Hanoi/Now,,,,,"La Habana, Cuba",1967,0:19:18,,"E. Cardenas, I. Gálvez, A. Herrera, A. Hernández, J. Martinez, J. Pucheux, D. Quesada, P. Rodríguez, R. Saavedra, N. Torrado, A. Valdes, Archivos ICAIC e ICR",Santiago Alvarez, ,,, ,,Norman Torrado,,,,Heitor Villa-Lobos,,,,
MXIM-AV-1-8-14,Jaguar,,,Ciné-plaisir,volumen 2,Francia,1967,1:50:00,,Jean Rouch,,,,,,,"José Matarasso, Liliane Korb, Jean-Pierre Lacam",,,,,,,,
MXIM-AV-1-8-15,La Chasse au lion à l´arc,,,,,Francia,1965,1:28:00,,Jean Rouch,,Jean Rouch,,,,,"Josée Mararasso, Dov hoenig","Idrissa Meiga, Moussa Hamidou",,,,,,,
MXIM-AV-1-8-16,La Direction d acteur por Jean Renoir,La dirección de actores,,,,Francia,1968,0:21:42,,Gisele Braunberguer,,,,,Edmond Richard,,Mireille Mauberna,René Forget,,,,,,,
MXIM-AV-1-8-17,La hora de los hornos,,,Noticiero ICAIC Latinoamericano,no. 393,Cuba,1968,0:20,,Santiago Álvarez Román,,,,,,,,,,,,,,,
MXIM-AV-1-8-18,La jetée,El muelle,,,,Francia,1963,0:26:50,,Chris Marker,,,,,,,Jean Ravel,,,,Trevor Duncan,,,,Jean Pierre Sudre
MXIM-AV-1-8-19,Heracles,,,Documentales y cortometrajes de  Werner Herzog (Antología),DVD 2,Alemania,1962,0:09:13,,Werner Herzog,,Werner Herzog,,,Jaime Pacheco,,,,,Uwe Brandner,,,,,
MXIM-AV-1-8-20,La punition,,,,,Francia,1962,0:58:34,,Jean Rouch,,Jean Rouch,,,"Michel Brault, Roger Morillière, Georges Dufaux",,Annie Tresgot,"Jean-Pierre Mirouze, Louis Boucher",Emile Lagarde,Jean-Crétien Bach,Club Francais du disque,,,,"Asistente: Jacqueline Grigaut-Lfévne, Direccion artística: René Bazar"
MXIM-AV-1-8-21,Law and order,,,,,Estados Unidos,1969,1:23:00,,Frederick Wiseman,,,,,"Bill Brayne, Asistente de cámara: David Martin",,Frederick Wiseman,,,,,,,,
MXIM-AV-1-8-22,Les années folles,Los años locos / Mad years,,,,Francia,1961,1:35:00,,"Miren Alexandresco, Henri Torrent ",,,,,,,,,,,"Georges Van Parys, Georges Tzipine",,,,
MXIM-AV-1-8-23,"Un lion nommé ""l´américain"" ","Un león llamado ""El americano""",,,,Francia,1968,0:20:00,,Jean Rouch,,,,,,,Jean-Pierre Lacam,Moussa Hamidou,,,,,,,"Asistentes: Damouré Zika, Lam Dia, Tallou"
MXIM-AV-1-8-24,México bárbaro,,,Colección Memoria Histórica,,México,1966,1:18:00,"Antonio Pérez Alías, Federica Martín, Alfonso Muñoz, Estela Kune, Miguel Ángel Menéndez, Miguel Antochiw, Héctor Castro, ",Oscar Menéndez,Oscar Menéndez,Jaime Septién ,,,Oscar Menéndez,"Nacho López, Archivo Casasola, Eduardo del Rio (Rius) ","Pedro Velázquez, Moíses Ortega, Beatriz Florez, Sergio Jurado, ",,Sergio Degollado Gómez,"Armando Zayas, Rodolfo S Alvarado, Grupo Tribu, El correo del Tiempo. ",,"Conducción: Víctor Mares, Rosario Muñoz Ledo, Emilio Ebergenyi, Juan Federico Engels Gómez.",,,"Textos: Víctor G. Atiyeh, Basado en: México bárbaro, de John Kenneth Turner."
MXIM-AV-1-8-25,Morir en Madrid,,,,,Francia,1961,1:27:00,,Frederic Rossif,,"Madeleine Chapsal, Frédéric Rossif",,,Serge Barsky,,,,,,Maurice Jarre,"Suzzanne Flon, Germaire Montero, Pierre Vappeck Roger, Jean Villar, ",,,"Asistentes: Suzanne Baron, Marie Sophie Dubus, Albert Knoble, Jean Viller"
MXIM-AV-1-8-26,"¡Muerte al invasor!, Reportaje especial sobre la agresión imperialista al pueblo de Cuba",,,Noticiero ICAIC Latinoamericano,no. 47,Cuba,1961,0:16:00,,Alfredo Guevara,,,,,"Julio Simoneau, Pablo Martínez, Mario Ferrer",,,,,,,Julio Batista,,,
MXIM-AV-1-8-27,Now!,,,Noticiero ICAIC Latinoamericano,,"La Habana, Cuba",1965,0:05:27,,"Tomás Gutierrez Alea, Santiago Álvarez",,,,,,,,,,,,,,,
MXIM-AV-1-8-28,Últimas palabras,,,Documentales y cortometrajes de  Werner Herzog (Antología),DVD 2,Alemania,1968,0:12:46,,Werner Herzog,,Werner Herzog,,,Thomas Mauch,,,,,,,,,,
MXIM-AV-1-8-29,Rumänien. Totenklage in Desa,,,,,,1968,0:02:19,,"Franz Simon,  A. Amzulescu",,,,,,,,,,,,,,,
MXIM-AV-1-8-30,Reportaje especial sobre la II Declaración de La Habana aprobada por el pueblo en Asamblea General,,,Noticiero ICAIC Latinoamericano,no. 88,Cuba,1962,0:10:06,,Santiago Álvarez,,,,,,,,,,,,,,,
MXIM-AV-1-8-31,Steam in Mexico,,,,,Estados Unidos,1963,0:47:00,,Mac Owen,,,,Mac Owen ,,,,,,,,,,,
MXIM-AV-1-8-32,Terminus,El final,,,,Inglaterra,1961,0:32:00,,John Schlesinger,,John Schlesinger,,,Ken Phipps,"Robert Paynter, ",Hugh Raggett,,,"Ron Grainer, Julian Cooper, Michell Raper, Mike Shaun, Vernon Neptune,  ","Ken Cameron, Star Sound",,,,"David Gladwell, Nicholas Hale, Jim Godfrey"
MXIM-AV-1-8-33,The Saturday Men,,,Look at britain,3,Inglaterra,1962,0:26:00,,John Fletcher,,,,,Brian Probyn,,Nicholas Hale,John Taylor,,,James Harpham,,,,
MXIM-AV-1-8-34,Comando 52,,,,,Alemania,1965,0:34:00,,Walter Heynowski,,,,,,,,,,,,,,,
