 DÉCADA 1970-1979,,,,,,,,,,,,
,,,DESCRIPTORES,,,ESTRUCTURA INTERNA,,,,,,
Código de referencia,Titulo propio,Sinopsis,Onomástico,Toponímico,Cronológico,Tipo de producción,Género,Fuentes,Recursos,Versiones,Formato original,Material extra
MXIM-AV-1-9-1,In the land of the war canoes (En la tierra de las canoas de guerra),"Una película muda de 1914, trata sobre el mundo del Kwakwaka'wakw (Kwakiutl) pueblos de la región Queen Charlotte, estrecho de la costa central de Columbia Británica, Canadá. escrita y dirigida por Edward S. Curtis y actuado en su totalidad por nativos Kwakwaka'wakw. La película combina muchas representaciones precisas de aspectos culturales de la cultura Kwakwaka'wakw. Otros aspectos de la película se basa en las tradiciones transmitidas oralmente de la Kwakwaka'wakw o en aspectos de otras culturas vecinas. La película también retrata con precisión rituales Kwakwaka'wakw que eran, en ese momento, prohibida por la prohibición canadiense promulgada en 1884 y no rescindido hasta 1951.","Motana, hijo de Kenada, Naida, hija de Waket, Kenada, Yaklus, ","Montana, Estados Unidos, Canadá. ",1914,,,,"Grabación de campo, música de época, actores, crestomatías, intertítulos",,,
MXIM-AV-1-9-2,Acting in Turn,"Este clásico del cine documental de la escuela británica bajo el patrocinio de la empresa Shell, narra la historia de la industria moderna a través del desarrollo de la rueda dentada y los engranajes. ",,,,Película documental,,Documentos,,,VHS,
MXIM-AV-1-9-3,Appunti per un´Orestiade africana,"Ante la posibilidad de filmar una adaptación de la Orestíada de Esquilo ambientada en África, Pasolini busca en dicho continente un escenario alternativo, así como nuevos rostros para Agamenón, Electra, Clitemnestra y los integrantes del coro. La película —verdadero storyboard visual— se compone de una combinación entre documental y escenas filmadas por el propio realizador en varias locaciones africanas, todo ello aderezado por los punzantes comentarios políticos y estéticos del cineasta. En algún momento, Pasolini llega incluso a considerar otras alternativas: por ejemplo, un melodrama musical en jazz, protagonizado por actores afroamericanos.","Esquilo, Agamnenon, Clitemnestra, Orestes, Cassandra, Electra, Furias, Apolo, Atenea, ","China, África, Argos, Troya, Atenas, Tanzania, Uganda, Lago Victoria, Lago Tanganica, Congo, Kigoma, Biafra, Kampala","1966, 1970",,,"Entrevistas, testimonios videorales, registros fílmicos de archivo","Grabación de campo, voz en off, conducción, narración, música de época",,,
MXIM-AV-1-9-4,Aurelia Steiner,"Es un cortometraje de 27 minutos dirigido por Marguerite Duras. La cámara a través del Sena de París a Boulogne-Billancourt al caer la noche en un barco que no se ve; se centra en los arcos y pilares de puentes, órdenes transeúntes, sombras en los juegos de agua.
Marguerite Duras lee con voz en off uno de sus textos: una carta de Aurélia Steiner, una de las figuras recurrentes de las novelas de Duras, escritos a Melbourne La chica evoca a través de una escena íntima - un río que pasa, un gato maullando escuálido luego muere etc. - La búsqueda de la comunión con otra persona cada vez nombrado, extranjero o desconocido todavía intensamente amado.",,"Sena, Francia.",,,,,"Grabación de campo, voz en off, narración",,,
MXIM-AV-1-9-5,Canciones para después de una guerra,"Evocación de los años de posguerra en España a través de canciones populares montadas sobre imágenes que buscan darle otro significado a las mismas. En una verdadera radiografía implacable, emotiva, lúdica, de aquel tiempo, aquella posguerra. Una propuesta original, en complicidad con el espectador, juego de ritmos, imágenes y sonidos, sutiles asociaciones mentales, sin necesidad de recurrir a ninguna convención argumental. 
Insólito y audaz espectáculo, libre, disidente respecto a toda normativa, académica o industrial, política o estética. Tuvieron que prohibirla durante años, inútilmente, hasta la muerte del dictador. ","Franco, Hitler, Roosvelt, Trotsky, Alfredo Maggi, Rafael Miran, Armando Calvo, Luis Miguel, ","España: Madrid, Santander, Salamanca., Roma, Hiroshima, ","1936, 1947",Película documental,,"Documentos, registros fílmicos de archivo, fotografías, gráficos, hemerografía, noticieros radiofónicos, ficción, programas de TV","Grabación de campo,  música de época, animación, voz en off",,,
MXIM-AV-1-9-6,El tigre saltó y mató… pero morirá… morirá,"Relato en cuatro canciones como homenaje a las víctimas del sadismo fascista que las fuerzas armadas y la C.I. A. vienen perpetrando en Chile desde el 11 de septiembre de 1973.
Nos volvemos a encontrar ante un montaje excepcional de Santiago Álvarez a base de imágenes y fotografías relacionadas con el golpe de estado de Pinochet en Chile. La consecución de las imágenes está acompañada con la voz de Víctor Jara (""Amanda"", ""El alma cubierta de banderas"" y ""Plegaria a un labrador"") y de Violeta Parra (¿Qué dirá el santo padre?).","Salvador Allende, Augusto Pinochet, Victor Jara",Chile,11 de septiembre 1973,Película documental,,"Registros fílmicos de archivo, fotografías, hemerografía","Música de época, intertítulos, incidentales, animación",,35 mm,
MXIM-AV-1-9-7,Historia de un documento,"En 1970, huyendo de la represión ejercida contra militantes del 68, Oscar Menéndez y Rodolfo Alcaraz se trasladaron a Europa llevando el material fílmico del movimiento estudiantil en busca de productores para realizar la película. A principios de 1971 la Radio y Televisión Francesa (ORTF) aceptó el proyecto de los mexicanos, quienes trabajaron durante casi un año que duró la producción de este film con la promesa de la ORTF de que al terminar, se proyectaría en la red de televisión europea. Esto no fue posible por la intervención directa contra la película del entonces gobierno de Luis Echeverría Álvarez. En noviembre del 2004 en el V Foro Internacional sobre las Nuevas Tendencias del Documental, Escenarios 2004, que realizó el Centro de Capacitación Cinematográfica (CCC) en la Ciudad de México, se pudo  exhibir la película por primera vez. Ahora, 34 años después, presentamos esta película narrada en francés y subtitulada en español que nos ofrece un episodio cinematográfico inédito ya que la película está realizada clandestinamente en 1970 en el penal de Lecumberri con los presos políticos de esa época. Esta obra reconfirma la vigencia de la lucha democrática sostenida por el movimiento estudiantil del 68.","Luis Echeverría, Gustavo Díaz Ordaz, Rubén Jaramillo, Othón Salazar, Valentín Campa, Demetrio Vallejo, Humboldt, ","Ciudad de México: Cárcel preventiva de Lecumberri, Plaza de las tres culturas de Tlatelolco, Zócalo, Palacio Nacional, ENAH, CU, IPN","1957, 1962, 1968, 1969, 1979, 1971, 2 de octubre de 1968",Película documental,,"Registros fílmicos de archivo, testimonio oral, fotografías","Grabación de campo, voz en off, conducción, música de época",,Súper 8,
MXIM-AV-1-9-8,La batalla de Chile: la insurrección de la burguesía,"Salvador Allende pone en marcha un programa de profundas transformaciones sociales y políticas. Desde el primer día la derecha organiza contra él una serie de huelgas salvajes mientras la Casa Blanca le asfixia económicamente. A pesar del boicot --en marzo de 1973-- los partidos que apoyan a Allende obtienen el 43,4 por ciento de los votos. La derecha comprende que los mecanismos legales ya no les sirven. De ahora en adelante su estrategia será la estrategia del golpe de estado. “La Batalla de Chile” es un fresco que muestra paso a paso estos hechos que conmovieron al mundo. http://www.patricioguzman.com/index.php?page=films_dett&fid=1","Salvador Allende, General Carlos Prats, Milía, Central Eléctrica de Trabajadores, Manuel Rodriguez, Sociedad Nacional de Agricultura, CIA, Partido Democrata Cristiano, Izquierd Unida, Unidad Popular,  MOPARE, Ismael Huerta,  Guillermo Medina, Alejandro Rojas,, Víctor García Garzena, Fernando Castillo,  ","Chile, Mina Chuquicamata, Mina El teniente, Universidad Católica, Tacamar, ","21 de mayo 1973, 15 de junio, 27 de junio, ",Película documental,,"Registros fílmicos de archivo,  testimonios videorales","Grabación de campo, voz en off, conducción, entrevistas",,35 mm,
MXIM-AV-1-9-9,El golpe de Estado,"Entre marzo y septiembre de 1973 la izquierda y derecha se enfrentan en la calle, en las fábricas, en los tribunales, en las universidades, en el parlamento y en los medios de comunicación. La situación se vuelve insostenible. Estados Unidos financia la huelga de los camioneros y fomenta el caos social. Allende trata de llegar a un acuerdo con las fuerzas de la Democracia Cristiana, sin conseguirlo. Las propias contradicciones de la izquierda aumentan la crisis. Los militares empiezan a conspirar en Valparaíso. Un amplio sector de la clase media apoya el boicot y la guerra civil. El ll de septiembre Pinochet bombardea el palacio de gobierno. http://www.patricioguzman.com/index.php?page=films_dett&fid=1","Salvador Allende, Augusto Pinochet, Alejandro Rojas, Alfonso Ansieta, Fernando Castillo, Carlos Prats, José Tohá, Mario Sepulveda, Guillermo Pickering, Teniente Pérez, Roberto Souper, Uros Domic, Rafael Veillena, Carlos Altamirano, Óscar Guillermo Guillén, Julio Estuardo, CUT, Arturo Araya Peeters, Gustavo Leigh, José Toribio Merino, César Mendoza, Gustavo Leigh Guzmán, ","Chile, Carretera Panamericana, Santiago, Cerillo, Vicuña, Valtierra, Plaza Bulnes, Valparaíso,  Recoleta, ",1973,Película documental,,Testimonios videorales,"Grabación de campo, voz en off, conducción, entrevistas",,35 mm,
MXIM-AV-1-9-10,L´Ambassade (La embajada),"La película dura veinte minutos y el espectador asume que sucede en una embajada situado en una gran ciudad de América del Sur, después de un golpe de Estado (probablemente Chile después del golpe de Estado del general Augusto Pinochet ). La cámara permanece en la embajada y las películas de la vida diaria de los refugiados, el embajador y su esposa que lo acogen.","Marco, Augusto Pinochet, Tsikos, Carole, Maria, ",Chile,"13 de septiembre de 1973, 29 de junio 1973, ",Película documental,,,"Grabación de campo, voz en off, conducción",,Súper 8,
MXIM-AV-1-9-11,La hora de los cerdos,Noticiero elaborado por Santiago Álvarez sobre las declaraciones realizadas por Fidel Castro con respecto al golpe de estado en Chile y su postura.,"Salvador Allende, Fidel Castro, Augusto Pinochet, Víctor Jara","Chile, Cuba",1973,Película documental,,"Registros fílmicos de archivo, hemerografía, fotografía, gráficos","Grabación de campo, intertítulos, música de época",,35 mm,
MXIM-AV-1-9-12,La Maréchal-ferrant (El herrero),"En esta película Georges Rouquier describe la actividad de herrero en la multiplicidad de sus aspectos. Pero el cineasta no limita su intervención a una descripción técnica pura, no olvida el hombre o su entorno familiar y de la aldea o de la historia, donde se matriculó en algún momento de su vida. El director de películas de Marcel Laforge, herrador instalado en una pequeña aldea en las Charentes, Garratt.

 La película es una reconstrucción; todo fue un montaje de realidades múltiples fragmentos. Este cortometraje se estructura en torno a tres temas se enfrentan a veces, pero a menudo se confunde: el hombre, la historia y el arte.",,,,Película documental,,"Fotografía, Registros fílmicos de archivo","Grabación de campo, voz en off, conducción, animación",,,
MXIM-AV-1-9-13,Le fond de l´air est rouge,"“El fondo del aire es rojo”  (1977) de Chris Marker abarca las décadas de los 60 y 70, desde el punto de vista de los principales movimientos sociales y revoluciones que vio el mundo. Lugares como Vietnam, La primavera de Praga, Chile, Cuba, París y su mayo del 68, México y la Plaza de las Tres Culturas… y tanto protagonistas anónimos como celebridades como Brezhnev, Fidel Castro, Jorge Semprún,  “Che” Guevara, Emil Zapotek, etcétera, aparecen en los fotogramas de “El fondo del aire es rojo”","Salvador Allende, Fidel Castro, Ernesto ""Che"" Guevara, Charles de Gaulle, Giangiacomo Feltrinelli, Qing Jiang, V.I. Lenin, André Malraux, Zedong Mao, Richard Nixon, Augusto Pinochet, Georges Pompidou, Joseph Stalin, Nguyen Giap Vo, Enlai Zhou, Paul Vergès, Simone Signoret, Paul Cèbe, Lenin, Geroges Frischmann, Lescure, Shah de Irán, Shirazi, Faterni, Lofti, Scherberwen, Rudi Dutschke, Regis Debray, Panteras Negras, Mao Zedong, Giscard D'Estaing, Douglas Bravo, Leoni, Mario Monje, Paul Seban, Wallander, Major Shleton, Albina du Boisrouvray, Leon Nicod, Phillippe de Joinet, Alain Peyreffite, Laura Allende, Luis Edson, Charles de Gaulle, rector Capelle, Alain Gesmar, M. Fanton, Cohn-Bendit, Geroges Séguy, M. Wolgensinger","La Paz, Bolivia, Cuba, Sierra Mestra, Vietnam, Canthó, China, Congo, Ca Mao,  México, Suecia, París, Estados Unidos, Moscú, Nueva Delhi, Argel, Indochina, Berlin, San Francisco, Boulevard Saint Michel, Metro Charone,  Rhodia, Montaña Halcón, Venezuela, Caracas, Santiago de Chile, Lovaina,  Sorbona, Varsovia, Bonn, Roma, Argel, Columbia, Rue Gay Lussac, Barrio Latino, Rue Drouet,   Brasil, Chile, Renault-Cleon, Saint Flotrentin, ","Movimientos estudiantiles de la década de los 60's, 1 de mayo de 1967, 2 de junio de 1967, 13 de marzo de 1967, 2 de mayo de 1968, 11 de abril de 1968, 1 de mayo de 1968, 10 de mayo de 1968, marzo de 1968, 14 de mayo de 1968 ",Película documental,,"Registros fílmicos de archivo, testimonios videorales","Grabación de campo, voz en off, narración, conducción, entrevistas",,,
MXIM-AV-1-9-14,Les Vacances du cinéaste (Las vacaciones de un cineasta),"Un pequeño pueblo despoblado del Aude. Una pareja de ancianos confía a la cámara del veraneante los recuerdos de otro tiempo: la guerra, la enfermedad, la muerte. El cineasta construye el film a partir de una serie de imágenes autónomas que, reunidas, componen su universo mental: la felicidad familiar, fragmentos de algunos films anteriores, dos poemas de los poetas holandeses Remco Campert y Lucebert, el retrato del abuelo del cineasta de quien aprendió a fotografiar.","Ben Webster, Campert Remco Lucebert",Aude,1974,Película documental,,"Testimonios orales, testimonios videorales, fotografía, gráficos, registros fílmicos de archivo, documentales, hemerografía","Grabación de campo, voz en off, conducción, entrevista, música de época",,"16 mm, Beta SP, DVD",
MXIM-AV-1-9-15,Los Albañiles,"Un reportaje-documental realizado por el Taller de Cine Octubre, acerca de las precarias condiciones laborales los trabajadores de la construcción, así como los obreros-soldadores organizados de Tula, Hidalgo. Testimonios cargados de ideología pseudo-marxista que intenta hacer un llamado a la sociedad sobre la sobreexplotación del trabajo por parte de la clase capitalista, en un intento de emulación del Tercer Cine latinoamericano desarrollado por los argentinos y cubanos en la década de los años 60's, combativo y denunciante, ya en el contexto mexicano.","ICA, TALLER CHURUBUSCO, COMISION DE CONTRATOS, FEMSA, INDECO, ","Tula, Pachuca, Ciudad de México",1974,Película documental,,"pintura, cartografía, música de época, registros radiofónicos","Entrevista, grabación de campo",,VHS,
MXIM-AV-1-9-16,Le train en marche ( El tren en marcha),"En Le train en marche, Marker retrata a Alexander Ivanovich Medvedkin y su cine-tren de los años treinta. En la película, Marker intercala material de archivo, fotografías y una entrevista con el director ruso. Medvekin diseñó un tren que sirvió de laboratorio fílmico, cuarto de edición y sala de proyección, que viajaba a diferentes pueblos de la Unión Soviética. Interesados en crear un cine propagandístico, él y su equipo filmaban e inmediatamente procesaban el material para proyectarlo en las comunidades. Su idea era ayudar a las personas a construir un nuevo mundo a partir de las películas que habían creado juntos. El cortometraje se realizó originalmente como un prefacio de la película Bonheur (Felicidad) de Medvedkin, pero desde entonces se ha vuelto uno de los trabajos más notables de Marker, presentando a su mentor a una audiencia más amplia. http://ambulante.com.mx/es/mas/documental/le-train-en-marche","Alexander Medvedkin, Lenin",Rusia,1930,Película documental,,"Registros fílmicos de archivo, fotografía, gráficos","Voz en off, conducción, música de época, animación",,,
MXIM-AV-1-9-17,Misión de Chichimecas. Guanajuato,"Un documental realizado por el Instituto Nacional Indigenista, en el que se retrata la vida del indígena contemporáneo en el campo mexicano, la severa pobreza que padece dentro de una sociedad que cada vez le margina más y le niega cualquier oportunidad de desarrollo o progreso. Se publicita la labor del Estado mexicano en favor de los pueblos indígenas para su integración definitiva a la sociedad mexicana, sin que se pasen por alto los elementos de su identidad indígena, pilar de la pluralidad étnica y multiculturalidad del país. (Este documental tiende a ser un discurso político de la época a favor de las instituciones del Estado moderno, sin ser éste reflejo de la realidad ni de la percepción de la mayoría. Bajo el telón de la teoría política en boga, que no concuerdan con la práctica, ni en ese momento ni actualmente, la ""integración"" trata de establecer una imagen ideal del funcionamiento del campo y sus habitantes indígenas: alimento, trabajo, educación, salud, etc. También es posible observarlo desde la perspectiva histórica, el contexto en que fue creado denota la necesidad de reforzar la debilitada imagen del Estado generada después de 1968. CEAL)",,,,Película documental,,,"Grabación de campo, puesta en escena",,VHS,
MXIM-AV-1-9-18,Petit à petit (Poco a poco),"En Ayorou, Damouré dirige, junto con Lam e Illo, una sociedad de importación y exportación llamada ""Poco a Poco"". Decide construir un edificio y se marcha a París para ver cómo se puede vivir en una casa de pisos. En la ciudad descubre las curiosas formas de vivir y pensar de la tribu de los parisinos, que describe en unas cartas que envía con regularidad a sus compañeros hasta que éstos, creyendo que se ha vuelto loco, mandan a Lam en su busca. En París Damouré y Lam se compran un Bugatti y conocen a Safi, Ariane y a Philippe. El grupo decide volver a África para construir la nueva casa, pero las dos mujeres y Philippe no consiguen acostumbrarse a la nueva vida y se marchan. (FILMAFFINITY)",,"Niger, Ayorou, Côto d´Or, París",,Película documental,,"Testimonios videorales, entrevistas, gráficos",Grabación de campo,,,
MXIM-AV-1-9-19,Queridísimos verdugos,"De la mano de los tres verdugos -“ejecutores de sentencias”- existentes en la España de los primeros años setenta, se explora una zona particularmente oscura de la Dictadura. Más allá del alegato contra la pena capital, la película indaga en la historia personal de los tres protagonistas y sus maneras de entender el oficio que desempeñan, de los ajusticiados por ellos en el garrote vil y de sus virtudes, de los crímenes que se castigan, de lo que piensan los expertos. Un retrato atroz de la sociedad en que se desenvuelven. Una reflexión implacable sobre el poder. http://www.basiliomartinpatino.com/film03.htm","Antonio López Sierra, Vicente Copete, Bernardo Sánchez Bascuñana","Alemania: Berlín. España: Badajoz, Andalucía, Granada, Sevilla, Burgos, Salamanca, Villamuriel, Valencia, ","1926, 1924, 1933",Película documental,,"Fotografías, documentos, testimonios orales, testimonios videorales, hemerografía, pintura, dibujo, registros fílmicos de archivo, gráficos","Grabación de campo, voz en off, conducción, música de época, entrevistas",,,
MXIM-AV-1-9-20,The Ax Fight (Pelea de hachas),"Unos reporteros asisten en 1971 a un conflicto en una aldea del Amazonas. La película está estructurada en cuatro partes. La primera consiste en la versión sin editar de lo que grabó el cámara. El caos de esta primera parte se clarifica en la segunda en la que Lchagno, uno de los reporteros, explica las fases de la lucha y las relaciones entre las gentes. La tercera parte explica los linajes de las aldeas implicadas para ilustrar el largo conflicto de años y las alianzas dentro de la aldea. Finalmente, en una versión corregida de la lucha, vemos cómo las manos de los redactores manipulan la realidad para generar una película suave que mantenga la integridad del acontecimiento y funcione como documento informativo. “La lucha del hacha”, hunde al espectador en los problemas del parentesco de Yanomano, de las alianzas, de la división del aldea, de la resolución de la violencia y del conflicto. También nos hace reflexionar sobre cómo los antropólogos y los reporteros traducen su experiencia a palabras y a imágenes coherentes.",,,,Película documental,,Fotografía,,,VHS,
MXIM-AV-1-9-21,Viva la República,"Análisis de la etapa republicana en Cuba, que abarca desde la terminación de la guerra de independencia hasta los inicios de la insurrección contra la dictadura batistiana. 
De la guerra revolucionaria de Cuba, iniciada en 1868 por Carlos Manuel de Céspedes, a la revolución socialista triunfante de 1950, existe una inevitable continuidad que víncula todas las aspiraciones y necesidades reales del cubano y de su nación. ","José Martí, Tomás Estrada Palma, Máximo Gómez, Calixto García, Edward Atkins,  Juanjo Alberto Gómez, William McKinley  (presidente de E.U., 1897-1901), Leonardo Wood (estadounidense gobernador general de Cuba), Theodoro Roosvelt (presidente de EU, 1901-1909), Charles Magoon (gobernador durante la ocupación estadounidense en Cuba), José Miguel Gómez (presidente de Cuba), Vladimir Ilich Lenin (líder de la facción bolchevique de Rusia), Alfredo Zayas (presidente de Cuba, 1921-1925), Adolfo Luque (jugador de béisbol), Eligio Sardiñas ""Kid Chocolate"" (box), José Raúl Capa Blanca (ajedrez), Rubén Martínez Villena (protesta de los 13), Julio Antonio Mella (funda la universidad obrera José Martí), Enoch H. Crowder, Gerardo Machado y Morales (presidente de Cuba, 1925-1933), Julio Antonio Mella (revolucionario cubano, cofundador del partido comunista cubano), Víctor Manuel (pintor cubano), Antonio María Armeu (músico cubano), Amadeo Roldán, Nicolás Guillén (escritos cubano), Antonio Viteras (revolucionario), Benjamín Sumer Welles (diplomático estadounidense), Carlos Manuel de Céspedes (presidente de Cuba, agosto-septiembre, 1933),  Fulgencio Batista (jefe del ejército de La Pentarquía, 1933), Ramón Grau San Martín (miembro de La Pentarquí, presidente interino, ""gobierno de los 100 días""), Carlos Hevia (presidente interino, enero 1934), Carlos Mendieta y Montefur (presidente de Cuba, 1934-1935), Lázaro Cárdenas (presidente de México, 1934-1940), Hitler, Fulgencio Batista (presidente de Cuba, 1940-1944), Ramón Grau San Martín (presidente de Cuba, 1944-1948), Carlos Prio Socarras (presidente de Cuba, 1948-1952), Fidel Castro (estudiante cubano de derecho), Fulgencio Batista (presidente de Cuba, 1952-1954), ","Cuba, Estados Unidos","20 de mayo 1902 (1er presidente de Cuba). 1906 (2a intervención norteamericana). 1868 (lucha por la independencia). 1899 (sigue la lucha por la independencia), 1883, 1912 (operaciones militares de los negros y mulatos cubanos). 6 de abril de 1917 (declaración de guerra de EU contra Alemania).  1915-1922 (inversiones de EU en Cuba). 1920 (cae el precio de la azúcar). 1926 (ciclón azota Cuba). 1927 (fundación partido comunista de Cuba). 1932 (precio más bajo de azúcar).  10 enero de 1929 (asesinato de Julio Mella), 1933 (cae gobierno de Machado), 1935 (asesinato de Antonio Guiteras), 10 octubre de 1940 (constitución cubana), 1952 (Batista borra la constitución), ",Película documental,Histórico,"Cartografía, fotografías, documentos, hemerografía, datos estadísticos, registros fílmicos, publicidad televisiva, programas de televisión","registros fílmicos, voz en off, música en off, animación,  fotografías, incidentales, conducción, dibujos, intertítulos",,35 mm,
MXIM-AV-1-9-22,Les tambours d'avant (Los tambores de antaño),"Un ""plano secuencia"", que muestra el punto culminante de un ritual de posesión, durante el cual los hombres de la aldea Simiri piden a los genios de la selva para proteger los cultivos contra las langostas. Para la ceremonia se utilizan tambores arcaicas: la ""tourou"" y ""bitti"", que sólo está jugando esta ocasión.   El tourou es una gran calabaza estiró piel de oveja, la Bitti, un tambor mucho mayor, la piel adornada con perlas, para llegar directamente a los oídos de los dioses. Estas dos tambores marcan un ritual posesión Simiri en Zermaganda (Níger). Durante tres días, la posesión no está llegando. En el cuarto día, Rouch decidió convertir algunos planes para la música de los tambores. Durante el rodaje, el viejo Sambou toma posesión. ""En la revisión de la película, se me ocurrió que el mismo conjunto de la película provocó y aceleró la posesión"", escrito Rouch, unos años más tarde.",,,,Película documental,,,"Grabación de campo, voz en off, conducción, música de época",,,
MXIM-AV-1-9-23,Stierkampf in Forcalhos (Toros en Forcalhos),"En el tercer domingo de agosto se celebra el festival consagrado al Santísimo Sacramento. El lunes una corrida de toros pública tiene lugar en la plaza del pueblo. Después de su entrada solemne en la arena, los combatientes, uno a uno o en grupos, cebo al toro con grandes triángulos de madera (varillas de 5 m), llamado forcao.",,Potugal,,Documental,Etnográfico,Grabación de campo,,,,
