MXIM-AV-1-9-24,Besuchsfest in Munggona (Visita al festival en Munggona),"En Irian Jaya / Papua Occidental, por la noche antes de que lleguen los invitados, los hombres bailan en una formación circular y cantar en el acompañamiento. El primer bailarín rompe el círculo llevando los bailarines juntos en el centro en forma de espiral. Posteriormente, el último bailarín de guía a la línea de baile de nuevo en la formación circular. Varias mujeres bailan al margen de la plaza del pueblo en una formación de fila.",,Nueva Guinea,,Documental,Etnográfico,Grabación de campo,,,,
MXIM-AV-1-9-25,La Soufriére,"Impactante documental del alemán Werner Herzog. En apenas treinta minutos describe la inesperada actividad de un volcán en La Soufrière, en la isla de Guadalupe, en la órbita colonial francesa del Caribe. El cineasta imprime emoción a las imágenes de la nube tóxica que expulsa el volcán, que según los expertos amenaza con la explosión de toda la montaña, lo que ha obligado a la evacuación de las proximidades. Aunque algún lugareño se niega a abandonar la zona. Curiosamente, las cosas no ocurrieron como vaticinaron los vulcanólogos, y gran parte del mérito de Herzog es sobreponerse a lo que podía ser una contrariedad para su documental, y revestirlo de un innegable interés. http://www.avalon.me/distribucion/catalogo/La-Soufri%C3%A8re","Werner Herzog, Edward Lachman, Jörg Schmidt-Reitwein, Dieb Cubaris, ",Antillas francesas: Isla de Guadalupe: Basseterre. La Martinica: Saint Pierre. ,"agosto 1976,  6 de mayo de 1902, 1901, 1956 ",Documental,,"Grabación de campo, fotografías, testimonios videorales","Grabación de campo, voz en off, conducción, música en off,  entrevistas",,,
MXIM-AV-1-9-26,Obitateli,"Pelechian plantea un film de enfrentamientos. El de las manifestaciones de la naturaleza, y de cómo el hombre interactúa en ella; el enfrentamiento entre dos tipos de montaje, y el enfrentamiento sonoro. Lo bello y lo feo. La contemplación (lo bello) y la influencia de Pelechian con respecto a la manipulación del tiempo y el sonido (duración de tomas largas y música armónica), sitúa una mirada, en este momento, en estado de gracia. La interacción del hombre en la naturaleza (lo feo), los planos acortados y los sonidos naturales sincrónicos, nos aleja del hábitat deseado en un principio. Una representación del caos a través de figuras apocalípticas de manadas de animales aterrorizados, pero que en la inercia de la huida encuentran el contrapunto de nubes de pájaros que escapan de la tierra y de los hombres, que la colonizan al ruido de los fusiles. http://www.divxclasico.com/foro/viewtopic.php?t=48100",,,,Película documental,Footage,Registros fílmicos de archivo,Incidentales,,,
MXIM-AV-1-9-27,Tarva Yeghanaknère,"""Tal vez una de las más bellas películas del cineasta, esta es sin duda una a la que ahora se le ofrece el reconocimiento internacional. Les Saisons (Las Estaciones) es un hermoso poema en el que se discute en una amplia parábola, los momentos decisivos de la historia armenia, desde los orígenes volcánicos hasta el período industrial. Pero más allá de esta simbólica donde también se puede leer la historia de la migración del pueblo armenio hay increíbles e inolvidables secuencias: la inercia lenta y aventurada de una trashumancia con carácter de ingravidez, como pasa, infinitamente , sobre la tierra o sobre las olas, despreciando todas las anclas; una visión lúdica, aliviados, cosecha y producción de heno, y este ritmo, especialmente este ritmo que alimenta la emoción sin habla y sin comentarios, y eso hace que todo el testimonio en el juicio de un humanismo saludable y sublime. http://www.artavazd-pelechian.net/filmo/filmo.htm""",,Armenia,,Película documental,,Registros fílmicos de archivo,"Grabación de campo, Incidentales",,,
MXIM-AV-1-9-28,Nawi,"Clásico documental etnográfico, realizado por el renombrado director David and Judith MacDougall, explorando la vida nómada de la tribu Jie en Uganda.
Filmada en un campamento de ganado Jie cerca del límite de Acholi, en el distrito de Karamoja en el noreste de Uganda. El Jie, un pueblo predominantemente pastoril, dejan sus hogares en la estación seca y el rebaño a su ganado a los campos de temporada, o nawi. Documentando los preparativos para el ganado y muestra la vida en el campamento, donde los hombres hablan y hacen los objetos de cuero y los niños juegan. (Fuente: OCLC WorldCat: http://www.worldcat.org/title/nawi/oclc/317009926)",,Uganda,,Película documental,Antropología visual,,"Intertítulos, grabación de campo",Idioma Jie con subtítulos en inglés,,
MXIM-AV-1-9-29,Under the men's tree,"Secuencia de 16 minutos rodada en un campamento de verano de la etnia Jie del Noreste de Uganda, refleja una mirada participativa del evento que registra. Así, asistimos como uno más a una discusión sobre la velocidad de los coches en un momento de descanso de los hombres que cuidan del ganado. La cámara registra primero planos y se mueve atendiendo la conversación. El efecto de representación es de proximidad y complicada del espectador, que aunque desconozca las estructuras de cultura de esta etnia y el documental no le aporte información conceptual sobre la misma, es capaz de compartir conjuntamente esta experiencia.",,Uganda,1968,Película documental,Antropología visual,,"Intertítulos, grabación de campo",Idioma Jie con subtítulos en inglés,,
MXIM-AV-1-9-30,El desencanto,"El poeta Leopoldo Panero murió en 1962 en Astorga, su ciudad natal. Catorce años más tarde Felicidad Blanc, su viuda, y sus tres hijos evocan aquel caluroso día de agosto. Y a partir de ese recuerdo surgen otros que se van encadenando. Y a través de la palabra y del recorrido por habitaciones, objetos, calles y lugares perdidos, se desvela la historia de unos años y de unas personas unidas por vínculos familiares que en ningún momento huyen de la expresión de sus diferencias y de sus identidades. (Fuente: FILMAFFINITY http://www.filmaffinity.com/es/film493008.html)","Felicidad Blanc, Leopoldo María Panero, Michi Panero, Juan Luis Panero, Marino Amaya, Azorín, Baroja, Luis Rosales, ",Astorga y Madrid,27 de agosto de 1972,Película documental,,"Fotografías, documentos, testimonios videorales","Grabación de campo, entrevistas",,,
